{
  "action_rule": {
    "action": "RUN_BOUNDED_500K",
    "field": "user_requested_scope_reviewed",
    "operator": "eq",
    "threshold": 1
  },
  "approval": {
    "approved_at": null,
    "approved_by": null,
    "authority_ref": null
  },
  "borderline_action": "NO_TRAIN",
  "comparability_selector": {
    "scientific_contract": "pcqm-k1-single-ema-500k-t4-native-v1"
  },
  "cost_model": {
    "assumptions": [],
    "kind": "measured_only"
  },
  "created_from_source_digest": "f070ed738bd1e849e9c384a14b7a795a8314fafc76c78874ac703d5b23c32e04",
  "early_stop_rule": null,
  "observation_point": null,
  "policy_id": "pcqm-k1-single-ema-500k-t4-native",
  "policy_type": "research_action",
  "promotion_rule": null,
  "required_observable_fields": [
    "user_requested_scope_reviewed"
  ],
  "schema": "molgap-policy-v1",
  "status": "candidate",
  "version": "1"
}
