{
  "action_rule": {
    "action": "RUN_NORMALIZATION_ABLATION",
    "field": "user_requested_scope_reviewed",
    "operator": "eq",
    "threshold": 1
  },
  "approval": {
    "approved_at": null,
    "approved_by": null,
    "authority_ref": null
  },
  "borderline_action": "NO_TRAIN",
  "comparability_selector": {
    "scientific_contract": "pcqm-k1-norm-ablation-100k-s42"
  },
  "cost_model": {
    "assumptions": [
      "Count both allocated T4 devices including idle, setup, qualification, evaluation and cleanup.",
      "8 allocated T4 device-hours and 4 wall-hours are ceilings, not measured costs."
    ],
    "kind": "measured_only"
  },
  "created_from_source_digest": "41595167e411b6be95191986c757c3e174b01e3b6ebf4569cbcd1eb1fe4df46f",
  "early_stop_rule": null,
  "observation_point": null,
  "policy_id": "pcqm-k1-norm-ablation-100k-s42",
  "policy_type": "research_action",
  "promotion_rule": null,
  "required_observable_fields": [
    "user_requested_scope_reviewed"
  ],
  "schema": "molgap-policy-v1",
  "status": "candidate",
  "version": "v1"
}
